"source_identifier","model","depositor","title","date_uploaded","date_modified","owner","series","issue_number","abstract","alternative_title","bibliographic_citation","corporate_name","resource_type","creator","keyword","license","publisher","date_created","subject","language","related_url","admin_note","visibility","original_download_link","remote_files"
"ws859f873","GenericWork","Mpls.Research.Info.Svcs@mpls.frb.org","Economic Diversity and the Resilience of Cities","2024-11-22T16:56:38+00:00","2024-11-22T19:25:49+00:00",,"Institute working paper (Federal Reserve Bank of Minneapolis. Opportunity and Inclusive Growth Institute)",106,"We show how local worker flow adjustment margins yield a theory-consistent sufficient statistic approximating the welfare effects of local shocks. Furthermore, we isolate a city’s insurance value as this approximation’s second-order term. Leveraging rich labor flows data across occupations, industries, and cities in France, we estimate spatial and non-spatial flows responses to local labor demand shocks. Less economically diverse French cities experience deeper contractions in gross outflows following negative shocks. In contrast, more economic concentration begets a modestly larger increase in gross worker flows following positive shocks. Altogether, we uncover a sizable welfare insurance gains from local economic diversity.",,,"Federal Reserve Bank of Minneapolis. Opportunity and Inclusive Growth Institute","Research Paper","Maghin, Helene;Fuchs, Simon;de Soyres, François;Kondo, Illenin O.","Sufficient statistic;Welfare;Concentration;Economic diversity;Labor flows","https://creativecommons.org/licenses/by-nc/4.0/","Federal Reserve Bank of Minneapolis","2024-11-22","J61 - Geographic Labor Mobility; Immigrant Workers;J62 - Job, Occupational, and Intergenerational Mobility; Promotion;J21 - Labor Force and Employment, Size, and Structure",,"https://doi.org/10.21034/iwp.106",,"open","https://researchdatabase.minneapolisfed.org/downloads/qf85nb50p",
"0c483j60j","GenericWork","Mpls.Research.Info.Svcs@mpls.frb.org","New Technologies and Jobs in Europe","2024-11-18T20:51:04+00:00","2025-01-27T16:31:12+00:00",,"Institute working paper (Federal Reserve Bank of Minneapolis. Opportunity and Inclusive Growth Institute)",105,"We examine the link between labour market developments and new technologies such as artificial intelligence (AI) and software in 16 European countries over the period 2011-2019. Using data for occupations at the 3-digit level, we find that on average employment shares have increased in occupations more exposed to AI. This is particularly the case for occupations with a relatively higher proportion of younger and skilled workers. While there exists heterogeneity across countries, only very few countries show a decline in employment shares of occupations more exposed to AI-enabled automation. Country heterogeneity for this result seems to be linked to the pace of technology diffusion and education, but also to the level of product market regulation (competition) and employment protection laws. In contrast to the findings for employment, we find little evidence for a relationship between relative wages across occupations and potential exposures to new technologies.",,,"Federal Reserve Bank of Minneapolis. Opportunity and Inclusive Growth Institute","Research Paper","Jimeno, Juan F.;Albanesi, Stefania;Dias da Silva, António;Lamo, Ana;Wabitsch, Alena","Artificial intelligence;Employment;Occupations;Skills","https://creativecommons.org/licenses/by-nc/4.0/","Federal Reserve Bank of Minneapolis","2024-11-18","J23 - Labor Demand;O33 - Technological Change: Choices and Consequences; Diffusion Processes",,"https://doi.org/10.21034/iwp.105","Published in: _Economic Policy_ (Vol. 40, Iss. 121, January 2025, pp. 71-139), https://doi.org/10.1093/epolic/eiae058.","open","https://researchdatabase.minneapolisfed.org/downloads/g732d9285",
"kp78gg58h","GenericWork","Mpls.Research.Info.Svcs@mpls.frb.org","Recalculating Sargent and Wallace’s “Some Unpleasant Monetarist Arithmetic”","2024-11-13T17:56:08+00:00","2025-02-26T21:44:31+00:00",,"Quarterly review (Federal Reserve Bank of Minneapolis. Research Department)","Vol. 44, No. 3","This note revisits and extends the seminal analysis by Sargent and Wallace, originally framed in terms of money growth rates. Here, I reexamine their model through two complementary lenses, treating the policy instrument as either (i) a sequence of interest rates or (ii) a sequence of seigniorage. In the process, I revisit Sargent and Wallace’s “spectacular” example and offer a variant that strengthens their conclusions.",,,"Federal Reserve Bank of Minneapolis. Research Department","Article","Werning, Iván",,"https://creativecommons.org/licenses/by-nc/4.0/","Federal Reserve Bank of Minneapolis","2024-11-13",,,"https://doi.org/10.21034/qr.4431",,"open","https://researchdatabase.minneapolisfed.org/downloads/pk02c9945",
"zs25x8631","GenericWork","Mpls.Research.Info.Svcs@mpls.frb.org","Argentina at a Crossroads","2024-11-13T18:23:45+00:00","2025-02-26T21:44:53+00:00",,"Quarterly review (Federal Reserve Bank of Minneapolis. Research Department)","Vol. 44, No. 3",,,,"Federal Reserve Bank of Minneapolis. Research Department","Article","Nicolini, Juan Pablo;Martinez Gonzalez, Tobias",,"https://creativecommons.org/licenses/by-nc/4.0/","Federal Reserve Bank of Minneapolis","2024-11-13",,,"https://doi.org/10.21034/qr.4432",,"open","https://researchdatabase.minneapolisfed.org/downloads/fx719m704",
"05741r922","GenericWork","Mpls.Research.Info.Svcs@mpls.frb.org","How Should Monetary Policy Respond to Housing Inflation?","2024-10-24T18:22:42+00:00","2024-10-25T20:42:47+00:00",,"Working paper (Federal Reserve Bank of Minneapolis. Research Department)",808,"A persistent rise in rents has kept inflation above target in many advanced economies. Optimal policy in the standard New Keynesian (NK) model requires policy to stabilize housing inflation. We argue that the basic architecture of the NK model—that excess demand is always satisfied by producers—is inappropriate for the housing market, and we develop a matching framework that allows for demand rationing. Our findings indicate that the optimal response to a housing demand shock is to stabilize inflation in the non-housing sector while disregarding housing inflation. Our results hold exactly in a version of the model with costless search and quantitatively in a version with housing search costs calibrated to match US data on housing tenure, vacancy rates, and the size of the real estate sector.",,,"Federal Reserve Bank of Minneapolis. Research Department","Research Paper","Bianchi, Javier;Mehrotra, Neil R.;McKay, Alisdair","Housing;Monetary policy;Stabilization policy;Inflation","https://creativecommons.org/licenses/by-nc/4.0/","Federal Reserve Bank of Minneapolis","2024-10-24","E24 - Employment; Unemployment; Wages; Intergenerational Income Distribution; Aggregate Human Capital; Aggregate Labor Productivity;E30 - Prices, Business Fluctuations, and Cycles: General (includes Measurement and Data);E52 - Monetary Policy",,"https://doi.org/10.21034/wp.808",,"open","https://researchdatabase.minneapolisfed.org/downloads/n870zr077",
"bc386j44x","GenericWork","Mpls.Research.Info.Svcs@mpls.frb.org","Homelessness","2024-10-22T15:49:23+00:00","2024-10-22T18:58:01+00:00",,"Institute working paper (Federal Reserve Bank of Minneapolis. Opportunity and Inclusive Growth Institute)",103,"We present a dynamic general equilibrium model of homelessness calibrated to the U.S. data and evaluate the effectiveness of several policies in the fight against homelessness. The model is designed to capture the most at-risk groups, producing a diverse homeless population that includes a significant portion experiencing short-term homelessness due to labor market shocks and a smaller portion facing chronic homelessness mostly due to health shocks. Our policy experiments reveal that the existing housing voucher program effectively reduces homelessness especially when the general equilibrium effects are accounted for. We show that increasing the reach of the program for eligible individuals can lead to further declines in the aggregate homeless rate relative to alternative forms of subsidies. However, policies targeted to help decrease homelessness are not as popular as general poverty reduction tools such as cash subsidies, which generate a larger welfare gain in our experiments.",,,"Federal Reserve Bank of Minneapolis. Opportunity and Inclusive Growth Institute","Research Paper","Zhao, Kai;İmrohoroglu, Ayşe Ökten","Income shock;General equilibrium;Health shock;Homeless;Housing","https://creativecommons.org/licenses/by-nc/4.0/","Federal Reserve Bank of Minneapolis","2024-10-22","H20 - Taxation, Subsidies, and Revenue: General;E20 - Consumption, Saving, Production, Investment, Labor Markets, and Informal Economy: General (includes Measurement and Data)",,"https://doi.org/10.21034/iwp.103",,"open","https://researchdatabase.minneapolisfed.org/downloads/ms35t886k",
"4x51hj27z","GenericWork","Mpls.Research.Info.Svcs@mpls.frb.org","Unique Implementation of Permanent Primary Deficits?","2024-10-17T20:51:22+00:00","2024-10-18T15:46:07+00:00",,"Working paper (Federal Reserve Bank of Minneapolis. Research Department)",807,"In an economy with incomplete markets and consumers who are sufficiently risk averse, we show that the government can uniquely implement a permanent primary deficit using nominal debt and continuous Markov strategies for primary deficits and payments to debtholders. But this result fails if there are also useless pieces of paper (bitcoin for short) that can be traded. If there is trade in bitcoin, then there is no continuous Markov strategy for the government that leads to unique implementation. Instead, there is a continuum of equilibria with distinct real allocations in which the price of bitcoin converges to zero. And there is a balanced budget trap: continuous government policies designed for a permanent primary deficit cannot eliminate an alternative steady state in which _r_ - _g_ = 0 and the government is forced to balance its budget. A legal prohibition against bitcoin can restore unique implementation of permanent primary deficits, and so can a tax on bitcoin at the rate -(_r_ - _g_) > 0.",,,"Federal Reserve Bank of Minneapolis. Research Department","Research Paper","Luttmer, Erzo G. J.;Amol, Amol","Fiscal policy;Primary deficits;Fiscal theory of the price level;Price level determinacy","https://creativecommons.org/licenses/by-nc/4.0/","Federal Reserve Bank of Minneapolis","2024-10-17","E60 - Macroeconomic Policy, Macroeconomic Aspects of Public Finance, and General Outlook: General;H60 - National Budget, Deficit, and Debt: General;E31 - Price Level; Inflation; Deflation",,"https://doi.org/10.21034/wp.807",,"open","https://researchdatabase.minneapolisfed.org/downloads/fj2362424",
"v979v3371","GenericWork","Mpls.Research.Info.Svcs@mpls.frb.org","Online Appendix: Dynamics of Deterrence: A Macroeconomic Perspective on Punitive Justice Policy","2024-10-15T19:36:05+00:00","2024-10-15T20:01:52+00:00",,"Institute working paper (Federal Reserve Bank of Minneapolis. Opportunity and Inclusive Growth Institute)",102,"This online appendix accompanies [Institute Working Paper 101: Dynamics of Deterrence: A Macroeconomic Perspective on Punitive Justice Policy](https://doi.org/10.21034/iwp.101).",,,"Federal Reserve Bank of Minneapolis. Opportunity and Inclusive Growth Institute","Research Paper","Guler, Bulent;Michaud, Amanda","Incarceration;Inequality trends;Dynamic policy evaluation","https://creativecommons.org/licenses/by-nc/4.0/","Federal Reserve Bank of Minneapolis","2024-10-15","E24 - Employment; Unemployment; Wages; Intergenerational Income Distribution; Aggregate Human Capital; Aggregate Labor Productivity;E69 - Macroeconomic Policy, Macroeconomic Aspects of Public Finance, and General Outlook: Other",,"https://doi.org/10.21034/iwp.102",,"open","https://researchdatabase.minneapolisfed.org/downloads/xd07gs902",
"cz30ps93t","GenericWork","Mpls.Research.Info.Svcs@mpls.frb.org","Dynamics of Deterrence: A Macroeconomic Perspective on Punitive Justice Policy","2024-10-15T17:07:13+00:00","2025-09-24T14:03:58+00:00",,"Institute working paper (Federal Reserve Bank of Minneapolis. Opportunity and Inclusive Growth Institute)",101,"We argue that transitional dynamics play a critical role in evaluating the effects of punitive incarceration reform on crime, inequality, and labor markets. Individuals’ past choices regarding crime and employment under previous policies have persistent consequences that limit their responsiveness to policy changes. We provide novel cohort evidence supporting this mechanism. A quantitative model of this theory, calibrated using restricted administrative data, predicts nuanced dynamics of crime and incarceration that are distinct across property and violent crime and similar to the U.S. experience after 1980. Increased inequality and declining employment accompany these changes, with unequal impacts across generations.",,,"Federal Reserve Bank of Minneapolis. Opportunity and Inclusive Growth Institute","Research Paper","Guler, Bulent;Michaud, Amanda","Inequality trends;Incarceration;Dynamic policy evaluation","https://creativecommons.org/licenses/by-nc/4.0/","Federal Reserve Bank of Minneapolis","2024-10-15","E24 - Employment; Unemployment; Wages; Intergenerational Income Distribution; Aggregate Human Capital; Aggregate Labor Productivity;E69 - Macroeconomic Policy, Macroeconomic Aspects of Public Finance, and General Outlook: Other",,"https://doi.org/10.21034/iwp.101","Related: [Institute Working Paper 102: Online Appendix: Dynamics of Deterrence: A Macroeconomic Perspective on Punitive Justice Policy](https://doi.org/10.21034/iwp.102);Forthcoming in: _International Economic Review_, https://doi.org/10.1111/iere.70016.","open","https://researchdatabase.minneapolisfed.org/downloads/q237hs07d",
"n009w248z","GenericWork","Mpls.Research.Info.Svcs@mpls.frb.org","Quits, Layoffs, and Labor Supply","2024-07-18T19:36:17+00:00","2024-10-18T18:40:56+00:00",,"Institute working paper (Federal Reserve Bank of Minneapolis. Opportunity and Inclusive Growth Institute)",94,"We develop a time series of quits and layoffs using the Current Population Survey, and analyze their relationship with labor supply decisions over the business cycle. Our findings challenge the assumption that most labor force exits from employment (EN) are voluntary quits. Instead, we show that 40% of these exits are precipitated by layoffs. With this distinction, both quits to non-participation and the share of workers exiting after a layoff falls during recessions. A workhorse search model is used to frame how these facts add nuance to our understanding of business cycles. Additional results explore regularities of these patterns in the cross section of workers, in the COVID-19 recovery, and in comparison to the JOLTS series on quits and layoffs.",,,"Federal Reserve Bank of Minneapolis. Opportunity and Inclusive Growth Institute","Research Paper","Ellieroth, Kathrin;Michaud, Amanda","Labor supply;Quits;Business cycles;Layoffs","https://creativecommons.org/licenses/by-nc/4.0/","Federal Reserve Bank of Minneapolis","2024-10-11","E32 - Business Fluctuations; Cycles;J21 - Labor Force and Employment, Size, and Structure;E24 - Employment; Unemployment; Wages; Intergenerational Income Distribution; Aggregate Human Capital; Aggregate Labor Productivity",,"https://doi.org/10.21034/iwp.94",,"open","https://researchdatabase.minneapolisfed.org/downloads/mg74qm295",
"b5644r73m","GenericWork","Mpls.Research.Info.Svcs@mpls.frb.org","Public Education and Intergenerational Housing Wealth Effects","2024-10-11T16:42:52+00:00","2024-10-11T16:57:31+00:00",,"Institute working paper (Federal Reserve Bank of Minneapolis. Opportunity and Inclusive Growth Institute)",100,"While rising house prices are known to benefit existing homeowners, we document a new channel through which house price shocks have intergenerational wealth effects. Using panel data from school zones within a large U.S. school district, we find that higher local house prices lead to improvements in local school quality, thereby increasing children's human capital and future incomes. We quantify this housing wealth channel using an overlapping generations model with neighborhood choice, spatial equilibrium, and endogenous school quality. We find that housing market shocks generate large intergenerational wealth effects that account for around one-third of total housing wealth effects.",,,"Federal Reserve Bank of Minneapolis. Opportunity and Inclusive Growth Institute","Research Paper","Gilraine, Michael;Graham, James;Zheng, Angela","Intergenerational mobility;Intergenerational wealth effects;School quality;Neighborhood choice;House prices","https://creativecommons.org/licenses/by-nc/4.0/","Federal Reserve Bank of Minneapolis","2024-10-11","R23 - Urban, Rural, Regional, Real Estate, and Transportation Economics: Regional Migration; Regional Labor Markets; Population; Neighborhood Characteristics;E24 - Employment; Unemployment; Wages; Intergenerational Income Distribution; Aggregate Human Capital; Aggregate Labor Productivity;J62 - Job, Occupational, and Intergenerational Mobility; Promotion;I24 - Education and Inequality;E21 - Macroeconomics: Consumption; Saving; Wealth;R21 - Urban, Rural, Regional, Real Estate, and Transportation Economics: Housing Demand",,"https://doi.org/10.21034/iwp.100",,"open","https://researchdatabase.minneapolisfed.org/downloads/w0892b257",
"0r967401k","GenericWork","Mpls.Research.Info.Svcs@mpls.frb.org","Health Inequality and Economic Disparities by Race, Ethnicity, and Gender","2024-10-01T17:22:44+00:00","2024-10-01T19:42:27+00:00",,"Institute working paper (Federal Reserve Bank of Minneapolis. Opportunity and Inclusive Growth Institute)",99,"We measure health inequality during middle and old age by race, ethnicity, and gender and evaluate the extent to which it can explain inequalities in other key economic outcomes using the Health and Retirement Study data set. Our main measure of health is frailty, which is the fraction of one’s possible health deficits and is related to biological age. We find staggering health inequality: At age 55, Black men and women have the frailty, or biological age, of White men and women 13 and 20 years older, respectively, while Hispanic men and women exhibit frailty akin to White men and women 5 and 6 years older. The health deficits composing frailty reveal that most health deficits are more likely for Black and Hispanic people than for White people, with the notable exception of those requiring a diagnosis. Imputing medical diagnoses to Black and Hispanic people uncovers even larger health gaps, especially for Black men. Health inequality also emerges as a powerful determinant of economic inequality. If Black individuals at age 55 had the health of their White peers, the life expectancy gap between these two groups would halve, and the gap in disability duration would decrease by 40-70%. Other outcomes are similarly affected by health at age 55, indicating that targeted health interventions for minority groups before middle age could substantially reduce economic disparities in the quantity and quality of life.",,,"Federal Reserve Bank of Minneapolis. Opportunity and Inclusive Growth Institute","Research Paper","Russo, Nicolò;Borella, Margherita;De Nardi, Mariacristina;McGee, Rory;Abram, Ross","Gender;Health inequality;Economic disparities;Ethnicity;Race","https://creativecommons.org/licenses/by-nc/4.0/","Federal Reserve Bank of Minneapolis","2024-10-01","I14 - Health and Inequality;H31 - Fiscal Policies and Behavior of Economic Agents: Household;D12 - Consumer Economics: Empirical Analysis",,"https://doi.org/10.21034/iwp.99",,"open","https://researchdatabase.minneapolisfed.org/downloads/tb09j590q",
"6395w7327","GenericWork","Mpls.Research.Info.Svcs@mpls.frb.org","Mass Production of Houses in Factories in the United States: The First and Only “Experiment” Was a Tremendous Success","2024-09-30T16:59:09+00:00","2024-09-30T19:24:01+00:00",,"Staff report (Federal Reserve Bank of Minneapolis. Research Department)",661,"We show that the first and only experiment of U.S. mass production of houses, in a factory-built home industry that became known as the Mobile Home industry (and today, as the Manufactured Home industry), was a tremendous success. Mobile Home prices-psf fell by two-thirds from 1955 to 1973, as productivity soared; home quality rose significantly, with Mobile Home building codes receiving ANSI certification in 1963 and National Fire Protection Association co-sponsorship in 1965; as production soared, Mobile Homes accounted for one-third of single-family homes produced in the early 1970s. These feats were achieved as industry leaders developed state-wide building codes for Mobile Homes. This dramatically increased the size of the market for them. Factories invested in specialized machinery to produce simple and standardized products, substituting machinery for labor. Given each factory produced under the same code, industry-induced productivity gains followed, including external effects and directed technical change. Lessons from this industry give insights into critical issues in today's residential construction industry. The poor productivity performance of today's residential construction industry is considered a puzzle. But this poor performance is not new. Our forebears before 1950 wrote extensively about the sector's poor performance, attributing it to the failure to adopt factory-built housing. Our analysis strongly supports this view - for their time and ours. It also supports their view, like that of Levitt & Sons, that factory production is the only way ""to produce the homes and apartments needed to house our expanding population and our underprivileged citizens in a comfortable, dignified, decent way,"" (U.S. Senate 1969).",,,"Federal Reserve Bank of Minneapolis. Research Department","Research Paper","Schmitz, James Andrew;Falcettoni, Elena;Wright, Mark L. J.","Building code;Affordable housing;Mobile homes;Mass production;Factory-built homes","https://creativecommons.org/licenses/by-nc/4.0/","Federal Reserve Bank of Minneapolis","2024-09-30","N00 - Economic History: General;L00 - Industrial Organization: General;N60 - Economic History: Manufacturing and Construction: General, International, or Comparative",,"https://doi.org/10.21034/sr.661",,"open","https://researchdatabase.minneapolisfed.org/downloads/ng451h69x",
"ft848q804","GenericWork","Mpls.Research.Info.Svcs@mpls.frb.org","To Have or Not to Have: Understanding Wealth Inequality","2024-09-24T19:26:14+00:00","2024-09-24T19:54:28+00:00",,"Institute working paper (Federal Reserve Bank of Minneapolis. Opportunity and Inclusive Growth Institute)",98,"Differences in household saving rates are a key driver of wealth inequality. But what determines these differences in saving rates and wealth accumulation? We provide a new answer to this longstanding question based on new empirical evidence and a new modeling framework. In the data, we decompose U.S. household wealth into its main portfolio components to document two new empirical facts. First, the variation in wealth by income is mainly driven by differences in participation in asset markets rather than by the amounts invested. Wealth differences are a matter of to have or not to have. Second, the large heterogeneity in asset market participation closely follows observed differences in access to asset markets. Combining these two facts, we develop a new model of life-cycle wealth accumulation in which income-dependent market access is the key driver of differences in asset market participation and saving rates by income. The calibrated model accurately captures the joint distribution of income and wealth. Eliminating heterogeneity in access to asset markets increases wealth accumulation in the bottom half of the income distribution by 32%. Facilitating access to employer-sponsored retirement accounts improves broad-based wealth accumulation in the U.S. economy. Historical data support the model’s prediction.",,,"Federal Reserve Bank of Minneapolis. Opportunity and Inclusive Growth Institute","Research Paper","Steins, Ulrike I.;Brendler, Pavel;Kuhn, Moritz","Wealth inequality;Labor market heterogeneity;Household portfolios","https://creativecommons.org/licenses/by-nc/4.0/","Federal Reserve Bank of Minneapolis","2024-09-24","H31 - Fiscal Policies and Behavior of Economic Agents: Household;D31 - Personal Income, Wealth, and Their Distributions;E21 - Macroeconomics: Consumption; Saving; Wealth",,"https://doi.org/10.21034/iwp.98",,"open","https://researchdatabase.minneapolisfed.org/downloads/5138jf10b",
